{
  "schema_version": "1.0",
  "event_id": "97000000-0000-4000-8000-000000000001",
  "event_type": "product.build.requested.v1",
  "occurred_at": "2026-08-25T12:10:02Z",
  "run_id": "97000000-0000-4000-8000-000000000002",
  "job_id": "97000000-0000-4000-8000-000000000003",
  "trace_id": "97000000-0000-4000-8000-000000000004",
  "payload": {
    "input_uri": "s3://rainpulse/products/97000000-0000-4000-8000-000000000002/pysteps-lk/pysteps-lk-1.1.0/forecast.zarr",
    "input_sha256": "ba7816bf8f01cfea414140de5dae2223b00361a396177a9cb410ff61f20015ad",
    "output_prefix": "s3://rainpulse/products/97000000-0000-4000-8000-000000000002/pysteps-lk/pysteps-lk-1.1.0/distribution/rp015-application-products-v1/",
    "model_run_id": "97000000-0000-4000-8000-000000000005",
    "issue_time": "2026-08-25T12:10:00Z",
    "grid_id": "fuzhou_118_123_25_27_0p01deg_v1",
    "model_id": "pysteps-lk",
    "model_version": "pysteps-lk-1.1.0",
    "model_config_version": "rp016-pysteps-lk-v1",
    "product_config_version": "rp015-application-products-v1",
    "product_bundle_contract_version": "1.0",
    "product_ids": {
      "rain_rate": "97000000-0000-4000-8000-000000000006",
      "accumulation_60": "97000000-0000-4000-8000-000000000007",
      "accumulation_120": "97000000-0000-4000-8000-000000000008"
    }
  }
}
